{
  "surveyId": "adora-ship-visit-001",
  "version": "2026-10-01-v1",
  "eventName": "ADORA MEDITERRANEA 방선투어",
  "deadline": "2026-10-06T23:59:59+09:00",
  "privacy": {
    "allowIdentity": true,
    "identityQuestions": [
      "R04"
    ]
  },
  "theme": "default",
  "intro": {
    "brand": "CRUISE INTERNATIONAL",
    "eyebrow": "2026.09.29 · BUSAN",
    "paragraphs": [
      "먼 곳까지 시간을 내어 아도라 메디테라니아 방선투어에 함께해 주셔서 진심으로 감사드립니다.",
      "비록 짧은 시간이었지만, 크루즈 전세선 판매와 운영을 직접 경험해 오신 전문가 여러분의 시각에서 선박의 현재 상태를 살펴봐 주시고 좋은 의견을 주시면 향후 개선에 적극 반영하겠습니다.",
      "아도라 크루즈 역시 한국 시장에 높은 관심을 가지고 있으며, 한국 시장을 위한 여러분의 의견을 적극적으로 반영할 의지가 있습니다. 이번에 주시는 의견은 잘 정리하여 아도라 측에 전달하고, 10월 20일 인스펙션에서도 주요 개선사항을 다시 확인하겠습니다.",
      "아도라 메디테라니아는 코스타 세레나호 철수 이후 한국 출발 차터사업을 이어갈 수 있는 중요한 대체 선박입니다. 이날 참석하신 모든 분들이 향후 한국출발 차터사업과 직접 연결된 만큼, 애정을 가지고 적극적인 의견을 부탁드립니다."
    ],
    "highlightText": "한국출발 차터사업과 직접 연결된 만큼",
    "emphasisParagraph": 3
  },
  "respondent": {
    "label": "참여 구분을 선택해주세요. (본인의 소속회사에 해당하는 카테고리를 골라주세요.)",
    "help": "",
    "options": [
      "모두투어",
      "팬스타",
      "롯데제이티비",
      "판매여행사",
      "기항지 및 운영관련",
      "기타"
    ]
  },
  "page": {
    "eyebrow": "ADORA MEDITERRANEA · EXPERT FEEDBACK",
    "title": "방선투어 전문가 비교평가",
    "lead": "아래 모든 점수 항목은 동일한 기준으로 평가해 주세요. 직접 경험하거나 확인하지 못한 항목은 ‘평가하기 어려움’을 선택하시면 평균점수 계산에서 제외됩니다.",
    "done": "소중한 의견을 아도라 측에 잘 전달하고 2027년 한국 전세선 준비에 반영하겠습니다."
  },
  "distribution": {
    "deadlineText": "응답 마감: 2026년 10월 6일",
    "sender": "CRUISE INTERNATIONAL"
  },
  "collector": {
    "adapter": "local-mock",
    "endpoint": "http://127.0.0.1:18791/submit"
  },
  "payload": {
    "format": "legacy",
    "surveyType": "C"
  },
  "title": "ADORA MEDITERRANEA 방선투어 전문가 비교평가",
  "eventDate": "2026-09-29",
  "scale": {
    "enabled": true,
    "min": 0,
    "max": 20,
    "baseline": 10,
    "baselineLabel": "COSTA SERENA = 10점",
    "lowLabel": "0~9점: 상대적으로 아쉬움",
    "sameLabel": "10점: 비슷함",
    "highLabel": "11~20점: 상대적으로 우수함",
    "baselineName": "COSTA",
    "allowNotEvaluated": true
  },
  "sections": [
    {
      "id": "overall",
      "title": "선박 전반",
      "subtitle": "선박의 현재 컨디션을 항목별로 평가해 주세요.",
      "en": "Overall Ship Condition",
      "theme": "sage",
      "questions": [
        {
          "id": "O01",
          "prompt": "선박 관리상태",
          "required": true,
          "type": "score",
          "min": 0,
          "max": 20,
          "baseline": 10,
          "help": "선박 전체의 관리 수준과 정돈 상태를 평가해 주세요."
        },
        {
          "id": "O02",
          "prompt": "청결도",
          "required": true,
          "type": "score",
          "min": 0,
          "max": 20,
          "baseline": 10,
          "help": "공용공간과 주요 시설에서 느낀 전반적인 청결 상태를 평가해 주세요."
        },
        {
          "id": "O03",
          "prompt": "시설 유지상태",
          "required": true,
          "type": "score",
          "min": 0,
          "max": 20,
          "baseline": 10,
          "help": "노후감, 시설 보수 상태, 설비 유지 수준을 종합해 평가해 주세요."
        }
      ]
    },
    {
      "id": "facilities",
      "title": "공용시설",
      "subtitle": "방선 중 확인한 주요 공용시설을 각각 평가해 주세요.",
      "en": "Public Facilities",
      "theme": "soft-blue",
      "questions": [
        {
          "id": "F01",
          "prompt": "공연 관련 시설",
          "required": true,
          "type": "score",
          "min": 0,
          "max": 20,
          "baseline": 10,
          "help": "극장, 공연장, 무대 및 전세선 행사 활용성을 중심으로 평가해 주세요."
        },
        {
          "id": "F02",
          "prompt": "바(Bar)·라운지·휴게시설",
          "required": true,
          "type": "score",
          "min": 0,
          "max": 20,
          "baseline": 10,
          "help": "바, 라운지, 휴식공간의 분위기와 활용성을 평가해 주세요."
        },
        {
          "id": "F03",
          "prompt": "수영장",
          "required": true,
          "type": "score",
          "min": 0,
          "max": 20,
          "baseline": 10,
          "help": "수영장 시설과 주변 공간의 상품성을 평가해 주세요."
        },
        {
          "id": "F04",
          "prompt": "야외데크",
          "required": true,
          "type": "score",
          "min": 0,
          "max": 20,
          "baseline": 10,
          "help": "야외공간의 규모, 쾌적성, 활용성을 평가해 주세요."
        },
        {
          "id": "F05",
          "prompt": "식당",
          "required": true,
          "type": "score",
          "min": 0,
          "max": 20,
          "baseline": 10,
          "help": "메인 레스토랑과 뷔페 등 일반 식당 시설을 평가해 주세요."
        },
        {
          "id": "F06",
          "prompt": "유료식당",
          "required": true,
          "type": "score",
          "min": 0,
          "max": 20,
          "baseline": 10,
          "help": "확인한 유료 레스토랑의 공간과 상품성을 평가해 주세요."
        },
        {
          "id": "F07",
          "prompt": "공용시설에서 특히 좋았던 점 또는 개선이 필요하다고 느낀 부분을 말씀해 주세요.",
          "type": "text",
          "required": true,
          "rows": 4,
          "maxLength": 1000,
          "linkedScores": [
            "F01",
            "F02",
            "F03",
            "F04",
            "F05",
            "F06"
          ]
        }
      ]
    },
    {
      "id": "fnb",
      "title": "음식·서비스",
      "subtitle": "이번 방선에서 직접 경험하거나 확인한 범위에서 평가해 주세요.",
      "en": "Food & Service",
      "theme": "warm-beige",
      "questions": [
        {
          "id": "S01",
          "prompt": "음식의 맛·품질·구성",
          "required": true,
          "type": "score",
          "min": 0,
          "max": 20,
          "baseline": 10,
          "help": "이번 방선에서 제공된 식사의 맛, 품질, 메뉴 구성을 종합해 평가해 주세요."
        },
        {
          "id": "S02",
          "prompt": "식음 서비스",
          "required": true,
          "type": "score",
          "min": 0,
          "max": 20,
          "baseline": 10,
          "help": "레스토랑 서비스의 응대, 진행, 제공 상태를 평가해 주세요."
        },
        {
          "id": "S03",
          "prompt": "승무원 응대·안내",
          "required": true,
          "type": "score",
          "min": 0,
          "max": 20,
          "baseline": 10,
          "help": "짧은 방문 중 직접 확인한 범위에서 승무원의 친절도와 안내 수준을 평가해 주세요."
        },
        {
          "id": "S04",
          "prompt": "음식과 서비스에서 특히 좋았던 점과 개선이 필요하다고 느낀 점을 말씀해 주세요.",
          "type": "text",
          "required": true,
          "rows": 4,
          "maxLength": 1000,
          "linkedScores": [
            "S01",
            "S02",
            "S03"
          ]
        }
      ]
    },
    {
      "id": "summary",
      "title": "종합평가·개선의견",
      "subtitle": "2027년 한국 전세선 준비를 위해 가장 중요한 의견을 부탁드립니다.",
      "en": "Overall Assessment & Improvements",
      "theme": "lavender",
      "questions": [
        {
          "id": "R01",
          "prompt": "전세선 운영 관점에서 본 아도라 메디테라니아의 종합평가",
          "required": true,
          "type": "score",
          "min": 0,
          "max": 20,
          "baseline": 10,
          "help": "선박 상태, 공용시설, 음식·서비스와 전세선 운영 적합성을 종합해 평가해 주세요."
        },
        {
          "id": "R02",
          "prompt": "코스타 세레나와 비교했을 때, 아도라 메디테라니아에서 가장 좋았던 점은 무엇입니까?",
          "type": "text",
          "required": true,
          "rows": 4,
          "maxLength": 1000,
          "linkedScores": [
            "R01"
          ]
        },
        {
          "id": "R03",
          "prompt": "2027년 한국 전세선 운영을 위해 아도라가 가장 우선적으로 개선해야 할 부분은 무엇이라고 생각하십니까?",
          "type": "text",
          "required": true,
          "rows": 4,
          "maxLength": 1000,
          "linkedScores": [
            "R01"
          ]
        },
        {
          "id": "R04",
          "prompt": "2027년 5월·10월에 진행될 아도라 항차에 대해 궁금한 점이나 건의사항이 있으시면 편하게 남겨주세요. 회신을 원하시는 경우 성함을 함께 남겨주시면 별도로 연락드려 답변드리겠습니다.",
          "type": "text",
          "required": true,
          "rows": 4,
          "maxLength": 1000,
          "linkedScores": [
            "R01"
          ]
        }
      ]
    }
  ]
}
